token,freq,df,sample,weight
los,133,129,"Tonight's episode of Raw is being broadcast live from the Staples Center in Los Angeles, CA. The scheduled matches for tonight’s card are:

",0
becky,133,126,"Tonight's episode of Raw is being broadcast live from the Sprint Center in Kansas City, MO. The scheduled matches for tonight’s card are:

S",0
deadly,132,131,"A few players enter the next round — which promises equal doses of sweet and deadly — with hidden advantages. Meanwhile, Jun-ho sneaks his w",-2
determined,132,132,"Ahead of the last round, distrust and disgust run deep among the finalists. Jun-ho makes a getaway, determined to expose the game's dirty se",0
seems,132,130,"It is now the last day of the first term, the promised day when pretending to be dating Tomoe ends. It seems as though everything has finall",0
prepares,132,132,"As Floyd settles in for a tasty treat, Gabby grabs a new piece of mail from the Meow Meow Mailbox and prepares for an action-packed day at k",0
change,132,131,"Peppa's older cousin Chloe comes to visit, and Peppa must play games by somebody else's rules for a change.",0
quickly,132,131,"When Peppa and Suzy learn that grown ups must work all day, they decide to play at working in a shop. But they quickly find it is very tirin",0
goldust,132,128,"Jim Cornette's newest client delivers a message to President Gorilla Monsoon. Plus, Bret Hart faces Goldust in the main event, and more.",0
heath,132,130,"Match #1: Evan Bourne & Kofi Kingston vs The Great Khali & Jindar Mahal

Match #2: Eve vs Beth Phoenix

Match #3: CM Punk vs R-Truth

Match ",0
ninjas,132,118,Robin gets caught by the Orochi Oniwabanshu in Orochi's castle. The ninjas attack Robin in order to find the truth of her intentions but wit,0
ship,131,119,"Gabby and Pandy take a travel adventure using a train, plane, cruise ship and hot air balloon — but they can't forget to take pictures for C",0
nikki,131,127,"Match #1: Kane vs CM Punk

 Match #2: Sin Cara vs Evan Bourne

 Match #3: Kofi Kingston vs Dolph Ziggler

 Match #4: Cage: Big Show vs Alber",0
able,130,123,"Because of the misunderstanding that she was dating Sakuta, Tomoe is able to resolve the agonizing situation of being asked out by the guy h",0
eddie,130,128,The WWE Championship is back around the waist of Triple H due to the officiating of Shawn Michaels. Former champion The Rock goes on a quest,0
looking,129,125,"While looking for the cause of Mai's Adolescence Syndrome, Sakuta ends up scheduling a date with Mai. On the day they promised, Sakuta tries",0
joins,129,129,"A new student, Gerald giraffe, joins the playgroup. They try a challenge of hide and seek.",0
flash,129,113,"Bret Hart competes in a steel cage match with Sycho Sid for the WWE Championship. Plus, Hunter Hearst Helmsley battles Flash Funk, Vader tak",0
law,129,118,"Mr. McMahon learns that even he isn't above the law when ""Stone Cold"" Steve Austin teaches him a lesson in hard time, but the boss may have ",0
boyz,129,116,"The Corporate Ministry seeks to eliminate its enemies, starting with Mr. McMahon. Triple H battles WWE Champion ""Stone Cold"" Steve Austin in",0
causes,128,128,"Sakuta has a dream that Mai reveals herself as the true identity of Touko Kirishima at a music festival held on April 1st. At the same time,",0
rumble,128,122,"After his match with El Matador, Ric Flair issues a career changing challenge to Mr. Perfect for Raw next week. WWE Champion Bret Hitman Har",0
universal,128,128,"After two grueling Fatal 4-Way Matches set the stage for an intense Raw main event clash between Finn Bálor and Roman Reigns, it was the ath",0
investigates,128,128,Detective and family man John Lowe investigates a chain of gruesome murders in Los Angeles. A mysterious tip points him to the enigmatic Hot,0
masha,128,91,"Masha heads out into the forest on an adventure, and stumbles across an empty house in the forest. Bear returns to find his house in shamble",0
hunt,127,125,Fun is only a snapshot away as Gabby and Pandy set out to take a group photo — and make time for a picture-perfect scavenger hunt!,0
needs,127,126,"SunnyCat invites Gabby to a Mermaid Sparkle Party in Mermaid-Lantis! But to attend, she needs to bring MerCat's blue crystal — and her speci",0
realizes,127,126,"After messing up his hug attack and getting a hole in his Pandy Pack, Pandy realizes he's having a bad day — but things just keep getting wo",0
called,127,126,Rebecca Rabbit has a little brother called Richard who is the same age as George.,0
captain,127,119,"Mummy Dog and Danny are very excited! Captain Daddy Dog is home from the sea, and he's bearing gifts! What can they be?",0
bobby,127,125,"As the road to WrestleMania IX continues, Papa Shango competes against the former WWE Champion, Bob Backlund. Bobby ""The Brain"" Heenan condu",0
beth,127,123,Mr. McMahon teams with Carlito to take on Triple H in a Steel Cage Match. John Cena is forced to surrender the WWE Championship to Raw Gener,0
alicia,127,123,"Match #1: Kane vs Alberto Del Rio

 Match #2: Daniel Bryan, Sin Cara & Ezekiel Jackson vs Cody Rhodes, Ted DiBiase & Ezekiel Jackson

 Match",0
lynch,127,120,"Tonight's episode of Raw is being broadcast live from the Sprint Center in Kansas City, MO. The scheduled matches for tonight’s card are:

S",0
rivalry,126,125,Money Inc. defends the WWE Tag Team Championship against the Beverly Brothers. Razor Ramon takes on Virgil. Bret Hart discusses losing his W,0
universe,126,124,"Love is in the air as two members of the WWE Universe get engaged. Lex Luger and Crush battle it out, but what happens when several Doink th",0
gold,126,125,"Intercontinental Champion Razor Ramon defends his belt against Tatanka. Plus, Diesel and Shawn Michaels put their Tag Team gold on the line.",0
tyson,126,122,"Boxing Legend Mike Tyson is announced as the guest enforcer for the ""Stone Cold"" Steve Austin vs. Shawn Michaels match at WrestleMania. Paul",0
victim,126,119,"The Undertaker teams with the NWO's Scott Hall & X-Pac to take on Bradshaw & ""Stone Cold"" Steve Austin in a Handicap main event. The Hardy B",0
need,125,122,The remaining players strategize on how to survive the night. Gi-hun proposes a risky plan — but he will need trustworthy allies to carry it,0
can't,125,124,"Gabby and Pandy take a travel adventure using a train, plane, cruise ship and hot air balloon — but they can't forget to take pictures for C",0
ric,125,125,"After his match with El Matador, Ric Flair issues a career changing challenge to Mr. Perfect for Raw next week. WWE Champion Bret Hitman Har",0
layla,125,122,"The September 8, 2008 Edition of RAW is a Professional wrestling television show of the WWE's RAW brand, which took place on September 8, 20",0
room,124,117,There's a new Gabby Cat in town: Marty the Party Cat! Gabby and Pandy show Marty all the fun features in the party room to make him feel wel,0
track,124,124,"Mr Dinosaur is George's favourite toy. When Mr Dinosaur goes missing, George is distraught. Daddy Pig helps Peppa to become a detective and ",0
santino,124,120,"In the first episode of Raw to air from Italy, Umaga's No Holds Barred Open Challenge for the Intercontinental Championship is accepted by S",0
gohan,124,110,"Goku and Gohan attend a reunion on Roshi’s island, where Goku introduces his son to all of his old friends. The smiles quickly fade, however",0
story,123,122,"Players pair off for the fourth game. Gi-hun grapples with a moral dilemma, Sang-woo chooses self-preservation and Sae-byeok shares her unto",0
despite,123,122,"Because of the misunderstanding that she was dating Sakuta, Tomoe is able to resolve the agonizing situation of being asked out by the guy h",0
sister,123,118,"Sakuta had been unable to see Mai, who was not only busy with work but had an order from her agency forbidding her from going on dates. The ",0
mike,123,118,"Boxing Legend Mike Tyson is announced as the guest enforcer for the ""Stone Cold"" Steve Austin vs. Shawn Michaels match at WrestleMania. Paul",0
khali,123,121,"John Cena goes one-on-one with The Great Khali in the main event. With Triple H going down with an injury in DX's battle with Rated-RKO, Edg",0
dexter,123,99,"Seth ""Freakin"" Rollins challenges Bobby Lashley for the United States Championship. The Miz calls out the enigmatic Dexter Lumis to explain ",0
daughter,123,118,"Georgia Miller arrives in the quaint New England town of Wellsbury with her daughter, Ginny, and her son, Austin, and quickly makes a big im",0
lost,122,122,"While looking for the cause of Mai's Adolescence Syndrome, Sakuta ends up scheduling a date with Mai. On the day they promised, Sakuta tries",0
days,122,121,"Sakuta from the other possible realm sends a message through Ikumi that reads, “Find Touko Kirishima, Mai-san is in danger.” After seeing th",0
named,122,120,"Sakuta dreams that on Christmas Eve, when he is meant to have a sleepover date with Mai, he instead goes on a date with a student named Sara",0
competition,122,117,"Playgroup is having a pet competition and everyone has brought their pets. Dr Hamster is the judge, but it is so hard to choose the best pet",0
cell,122,102,"""Stone Cold"" Steve Austin confronts Undertaker about his recent assault at the hands of Kane and Mankind. The ominous Hell in a Cell makes i",0
wade,122,120,"Twenty-four hours earlier, at Night of Champions, several WWE Superstars were in heaven when they earned new championships. During Raw, howe",0
powerful,122,120,"After crashing Rusev and Lana’s post-wedding “celebration” with the WWE Universe on Raw, Roman Reigns targeted the United States Champion on",0
lucifer,122,85,"Upon leaving hell, Lucifer Morningstar retreats to Los Angeles for a more exciting life. When the murder of a friend connects him with LAPD ",0
enough,121,117,Ready. Set. Compete! CatRat takes center stage and hosts a series of dazzling dollhouse games. Will the crew win enough tickets to take home,0
recent,121,119,"Bob Backlund answers for his recent attack on Bret Hart. Plus, Lex Luger, The Heavenly Bodies, Yokozuna, and more in action on this episode.",0
four,121,117,"Before Shawn Michaels can celebrate his reign as the new WWE Champion, The Heartbreak Kid is greeted by the four men who are hell-bent on ta",0
apartment,121,106,"When Jake's building goes co-op and he must pay nearly a half million dollars to keep his apartment, he desperately seeks Gina's help.",0
farmer,121,105,"On the morning of the mock trial, Kyle's behavior worries everyone. Meanwhile, Dana Sue sparks a connection with a handsome farmer.",0
fun,120,118,Fun is only a snapshot away as Gabby and Pandy set out to take a group photo — and make time for a picture-perfect scavenger hunt!,1
parents,120,116,Madame Gazelle shows Peppa and her school friends how to make a time capsule. They discover that their parents made a time capsule many year,0
she's,120,116,"Granny Pig is really pleased with all the plastic gnomes and the wishing well she's got for the garden, but Grandpa Pig wishes they would al",0
ben,120,116,"Parting is such sweet sorrow for Mr. McMahon when WWE Champion ""Stone Cold"" Steve Austin gives the owner of WWE a fond farewell. Plus, The U",0
rowan,120,109,"Tonight's episode of Raw is being broadcast live from the Baltimore Arena in Baltimore, MD. The scheduled matches for tonight’s card are:

S",0
scene,120,116,"After a sudden behavior change raises concern among his friends, Marcus has a tearful meeting with Ginny. Austin witnesses a terrifying scen",0
leaving,119,117,"Even after leaving Fujisawa for Ogaki, not one person remembered anything about Mai Sakurajima. Sakuta and Mai return to school together, bu",0
meeting,119,116,Peppa and friends visit a Petting Farm where they enjoy feeding chickens and meeting cute and squeaky guinea pigs and they all learn it's im,0
claire,119,90,"The gang goes to a wine bar and runs into Penny’s old boyfriend, Zack. Also, Bernadette gets stuck spending the evening with Sheldon when sh",0
queen,118,105,"Miss Rabbit is to be given the Queen's Award for Industry, and Peppa and her friends are to accompany her to the palace to meet the Queen!",0
side,118,115,"Peppa and her family go to Italy, where Daddy Pig finds driving on the other side of the road difficult.",0
powers,118,116,"Jerry ""The King"" Lawler squares off against Jim Powers. The Beverly Brothers battle The Steiner Brothers in tag team action. Virgil faces Ba",0
hondo,118,109,"A locally born SWAT sergeant, former Marine Daniel “Hondo” Harrelson, is newly tasked to run a specialized tactical unit that is the last st",0
styles,117,111,Madame Gazelle gets Peppa and her playgroup friends to dance to all different styles of music.,0
know,117,114,Madame Gazelle has to go to the dentist so she leaves the class with Mr. Bull. The children already know the subjects Mr. Bull suggests teac,0
ends,116,114,"The final round presents another cruel test — but this time, how it ends depends on just one player. The game's creator steps out of the sha",0
upon,116,113,"Upon inducing a case of ""Puberty Syndrome"" where two copies of herself exists, Rio ends up staying at Sakuta's house for the time being. Mea",0
ever,116,115,Peppa and Suzy Sheep are best friends. But one day they have a quarrel over a game of cards and decide they are not best friends anymore. As,0
erick,116,106,"Tonight's episode of Raw is being broadcast live from the Baltimore Arena in Baltimore, MD. The scheduled matches for tonight’s card are:

S",0
tanjiro,116,58,"It is the Taisho Period (i.e. 1912-1926). Tanjiro Kamado is living a modest but blissful life in the mountains with his family. One day, whe",0
hand,115,112,"No-eul tries to gain the upper hand in negotiations, but her plans backfire. Gi-hun faces a moral crossroads, testing his limits — how far w",0
person,115,109,"Even after leaving Fujisawa for Ogaki, not one person remembered anything about Mai Sakurajima. Sakuta and Mai return to school together, bu",0
second,115,113,"Sakuta had been unable to see Mai, who was not only busy with work but had an order from her agency forbidding her from going on dates. The ",0
history,115,114,One of the most infamous factions in WWE history is formed as Shawn Michaels teams with Hunter Hearst Helmsley against The Undertaker & Mank,0
undisputed,115,113,"Before the tournament to crown the first Undisputed WWE Champion at Vengeance, Ric Flair gives Chris Jericho an opportunity to face ""Stone C",0
stay,114,112,"A tiny suitcase surprise leads to a fancy hotel stay for Gabby and Pandy, featuring ""cat-abulous"" spa treatments and a popping pool party.",0
along,114,113,"CatRat takes Gabby and Pandy on a puzzle hunt through the dollhouse, where they solve riddles, play games and find fun surprises along the w",0
runs,114,113,Cakey runs out of sprinkles on the most sprinkle-riffic day of the year: his birthday! Can Cakey's friends figure out a way to bring his spr,0
sea,114,107,Peppa and George are at the seaside with Granny and Grandpa Pig. Peppa rescues a little fish and puts it back in the sea.,0
boy,114,101,Peppa and George are playing in the garden with their bouncy ball when Suzy Sheep turns up with two tennis rackets. She uses the bouncy ball,0
bradshaw,114,113,"With ""Stone Cold"" Steve Austin losing the WWE Championship to Kurt Angle, The Alliance looks to regroup. Booker T is charged with recapturin",0
marella,114,111,"In the first episode of Raw to air from Italy, Umaga's No Holds Barred Open Challenge for the Intercontinental Championship is accepted by S",0
took,114,112,"The September 8, 2008 Edition of RAW is a Professional wrestling television show of the WWE's RAW brand, which took place on September 8, 20",0
arrive,113,111,"Peppa and her friends and family are looking forward to a trip to the seaside where they can make sandcastles, but when they arrive at the b",0
determine,113,113,A Battle Royal will determine the two contenders for the vacant WWE Intercontinental Championship. Doink clowns around with Bobby Heenan.,0
heart,113,103,The 1-2-3 Kid's new alliance pays dividends. Shawn Michaels gives his all in a match that proves there is more than one way to spell heart.,0
tamina,113,111,"Match #1: Kane vs Alberto Del Rio

 Match #2: Daniel Bryan, Sin Cara & Ezekiel Jackson vs Cody Rhodes, Ted DiBiase & Ezekiel Jackson

 Match",0
bay,113,109,"Tonight's episode of Raw is being broadcast live from the Resch Center in Green Bay, WI. The scheduled matches for tonight’s card are:

Sing",0
girlfriend,113,107,"Without Dr. Sturgis’ university class, Sheldon must find a new way to stay academically challenged. Also, Mary helps Pastor Jeff avoid tempt",2
elimination,112,96,"The players prepare for the next game: a six-legged pentathlon, where each team member must clear a mini-game to survive — or face collectiv",-1
taken,112,108,"Even after leaving Fujisawa for Ogaki, not one person remembered anything about Mai Sakurajima. Sakuta and Mai return to school together, bu",0
clash,112,112,"The showdown unfolds as Vader takes on Bret Hart, and the clash continues with Dude Love facing off against Rockabilly.",0
xavier,112,108,"Tonight's episode of Raw is being broadcast live from the Nutter Center in Dayton, OH. The scheduled matches for tonight’s card are:

Six Ma",0
zayn,112,103,"Tonight's episode of Raw is being broadcast live from the Baltimore Arena in Baltimore, MD. The scheduled matches for tonight’s card are:

S",0
whose,112,110,"Spring has come, the starlings have arrived! But a pigeon settles in the birdhouse near the Bear's house - and Masha, of course, is only hap",0
booba,112,98,Booba finds himself in a kitchen. The fridge enchants him so much that he is ready for everything to conquer it!,0
boyfriend,111,107,"Because of the misunderstanding that she was dating Sakuta, Tomoe is able to resolve the agonizing situation of being asked out by the guy h",2
identity,111,110,"Sakuta has a dream that Mai reveals herself as the true identity of Touko Kirishima at a music festival held on April 1st. At the same time,",0
right,111,108,"When Gabby and Pandy turn tiny from one of MerCat's potions, they'll need to gather the right ingredients to help them grow back to their us",0
full,111,109,"CatRat wants everything to be perfect for his grandma's visit. But when things don't go as planned, the day is full of new and exciting surp",0
land,111,107,"Peppa and her family are on holiday in their special camper van. They decide to go to Duck Land, a park where they can see the ducks in the ",0
brand,111,106,Peppa and George are helping Grandpa Pig to dig a brand new pond for his garden.,0
titus,111,108,"Sheamus &amp; CM Punk vs Daniel Bryan &amp; Kane
Dolph Ziggler vs Jack Swagger
Alberto Del Rio vs Santino Marella
Darren Young &amp; Titus O",0
shaun,111,102,"When a cabbage bounces into the field from a passing truck, Shaun and his pals decide to use it as a football, with little help from the pig",0
attacks,110,105,"A poltergeist-like phenomenon attacks Ikumi. Sakuta is worried the attack was caused by Puberty Syndrome, but Ikumi claims that the only way",-1
major,110,109,"Sakuta has a dream that Mai reveals herself as the true identity of Touko Kirishima at a music festival held on April 1st. At the same time,",0
catch,110,110,Pedro gets a cough at playschool and the other children soon catch it.,0
fire,110,98,Peppa and George go to the fire station to see Miss Rabbit's fire engine.,0
seeks,110,109,"Mr. Perfect battles Ric Flair in a Loser Leaves WWE Match. """"Macho Man"""" Randy Savage seeks revenge when he battles The Repo Man. Kamala, wi",0
suspect,110,106,"Triple H vows to make Mr. McMahon pay for costing him the WWE Championship, but The Game may have to answer for a crime of his own when he b",0
lashley,110,108,Shawn Michaels and WWE Champion John Cena take on The Undertaker and World Heavyweight Champion Batista. As his 'Battle of the Billionaires',0
information,110,107,Dandy gives the Twins troubling information about Chester. Maggie vows to prove her loyalty to Jimmy. The Freaks enforce their harsh code of,0
franky,110,90,"The people who attacked Zoro reveal themselves to be the feared ""Franky Family"", though they're no match for Zoro. Luffy have their gold exc",0
offer,109,107,"Sakuta sees a familiar Miniskirt Santa on a beauty pageant website that his friend Takumi Fukuyama was looking at. However, he notices that ",0
thinks,109,106,"George and Peppa are playing hide and seek, and Peppa thinks that George is bad at the game.",0
upcoming,109,109,"After his match with El Matador, Ric Flair issues a career changing challenge to Mr. Perfect for Raw next week. WWE Champion Bret Hitman Har",0
drug,109,101,"To catch a drug dealer, Jake and Charles must team up with an incompetent Postal Service investigator. Meanwhile, the team helps Amy quit sm",-1
encounter,108,108,Gi-hun and his team take turns keeping guard through the night. The masked men encounter trouble with their co-conspirators.,0
secrets,108,106,"Ahead of the last round, distrust and disgust run deep among the finalists. Jun-ho makes a getaway, determined to expose the game's dirty se",0
front,108,105,"Even as Gi-hun supports Jun-hee amid rising tensions, she must make a pivotal decision. Before the final game, the Front Man gives Gi-hun an",0
figure,108,107,Cakey runs out of sprinkles on the most sprinkle-riffic day of the year: his birthday! Can Cakey's friends figure out a way to bring his spr,0
revenge,108,107,"Mr. Perfect battles Ric Flair in a Loser Leaves WWE Match. """"Macho Man"""" Randy Savage seeks revenge when he battles The Repo Man. Kamala, wi",-2
o'neil,108,105,"Sheamus &amp; CM Punk vs Daniel Bryan &amp; Kane
Dolph Ziggler vs Jack Swagger
Alberto Del Rio vs Santino Marella
Darren Young &amp; Titus O",0
rusev,108,101,"Tonight's episode of Raw is being broadcast live from the Smoothie King Center in New Orleans, LA. The scheduled matches for tonight’s card ",0
paige,108,100,"Tonight's episode of Raw is being broadcast live from the Smoothie King Center in New Orleans, LA. The scheduled matches for tonight’s card ",0
evidence,108,107,"After new revelations surface, Peter and Rose scramble to find more evidence with help from Chelsea and Maddie. A bigger threat looms at Cam",0
begin,107,107,Super Gabby and Super Pandy shrink down to save the day from a mischievous CatRat. Can they solve his playful puzzles? Let the marvelous mis,0
hard,107,104,Daddy Pig finds it hard work when he runs a race to raise money for the school roof. It is far easier to run when a wasp is chasing him.,0
confront,107,105,"After being crowned the 1997 King of the Ring, Hunter Hearst Helmsley looks to begin his ascension to the top of WWE. ""Stone Cold"" Steve Aus",0
rosa,107,103,"The February 2, 2009 Edition of RAW is a Professional wrestling television show of the WWE's RAW brand, which took place on February 2, 2009",0
lily,107,96,"As Conrad battles a group of overly aggressive attending physicians on behalf of a patient with a mysterious chronic ailment, he also must f",0
strange,106,103,"Soon after Mai's ""puberty syndrome"" is resolved, Sakuta encounters another strange phenomenon without respite. Day after day, it is the same",0
super,106,102,Super Gabby and Super Pandy shrink down to save the day from a mischievous CatRat. Can they solve his playful puzzles? Let the marvelous mis,0
fighting,106,102,Today is the fire station practice day. Mummy Pig joins with the other mummies to practise fighting fires.,-1
william,106,104,William Shatner joins Jerry 'The King' Lawler on The King's Court. Razor Ramon defends the Intercontinental Title and much more.,0
killua,106,75,"During the first test, a number of participants fall out from fatigue after running for at least forty kilometers. Leorio almost gives up un",-3
sasuke,106,67,"On the way to becoming a ninja, Naruto must team up with his classmates, the pretty Sakura and the pretty serious Sasuke...",0
desperate,105,105,"Hoping to win easy money, a broke and desperate Gi-hun agrees to take part in an enigmatic game. Not long into the first round, unforeseen h",-2
feelings,105,101,"Puberty syndrome – Abnormal experiences rumored on the internet to be caused by sensitivity and instability during adolescence. This year, S",0
difficult,105,103,"Peppa and her family go to Italy, where Daddy Pig finds driving on the other side of the road difficult.",0
enemy,105,98,A new Commissioner is appointed to teach a lesson in respect to The Hart Foundation. Shawn Michaels embraces a new attitude while earning a,0
sami,105,105,"Tonight's episode of Raw is being broadcast live from the Baltimore Arena in Baltimore, MD. The scheduled matches for tonight’s card are:

S",0
discovery,105,105,"After a night out with Zion, Paul comes home to a startling discovery. Austin receives a surprise visitor at school.",-1
struggle,105,103,George Sr. and Connie struggle to manage the Cooper household while Mary plans Pastor Jeff’s wedding.,0
elaine,105,98,Jerry is robbed after Kramer fails to close the apartment door. Elaine talks Jerry into looking at a fabulous apartment in the hopes that sh,0
carrie,105,89,"At a birthday party for thirty-something Miranda, Carrie and her friends vow to stop worrying about finding the ""perfect"" male and start hav",0
several,104,104,"Puberty syndrome – Abnormal experiences rumored on the internet to be caused by sensitivity and instability during adolescence. This year, S",0
want,104,104,"Sakuta dreams that on Christmas Eve, when he is meant to have a sleepover date with Mai, he instead goes on a date with a student named Sara",0
