token,freq,df,sample,weight
tests,52,51,Alex uses an unconventional treatment to save a dying patient. A Halloween-hating couple tests Iris’s limits.,0
diana,52,49,"Liza struggles with the anxiety of sex with Josh and gets a little help from Maggie. At work, Kelsey pulls out all the stops to land a hot n",0
agrees,51,50,"Hoping to win easy money, a broke and desperate Gi-hun agrees to take part in an enigmatic game. Not long into the first round, unforeseen h",0
enter,51,51,"A few players enter the next round — which promises equal doses of sweet and deadly — with hidden advantages. Meanwhile, Jun-ho sneaks his w",0
won,51,50,"New players gather for a chance to win 45.6 billion won. After an intense first round, the survivors' fates hang in the balance — down to on",0
sakuta,51,22,"Puberty syndrome – Abnormal experiences rumored on the internet to be caused by sensitivity and instability during adolescence. This year, S",0
encounters,51,51,"Puberty syndrome – Abnormal experiences rumored on the internet to be caused by sensitivity and instability during adolescence. This year, S",0
asked,51,50,"Because of the misunderstanding that she was dating Sakuta, Tomoe is able to resolve the agonizing situation of being asked out by the guy h",0
presence,51,51,"Because of the misunderstanding that she was dating Sakuta, Tomoe is able to resolve the agonizing situation of being asked out by the guy h",0
commercial,51,41,"Unable to deal with a commercial filming well as the actress Mai Sakurajima, Nodoka gradually starts to feel a strong sense of inferiority. ",0
tracks,51,48,"Upon searching the hashtag #DREAMING, numerous posts were found about attending a middle school reunion on November 27th. Ikumi also dreamt ",0
receive,51,50,Gabby and Pandy receive special sashes and start their journey as kitty rangers! Can they use their new skills to solve a missing mama myste,0
catches,51,51,"After Kitty Fairy catches a cold, Gabby and Pandy deliver dandelion soup and step in to save the day.",0
rainbow,51,46,Gabby and Pandy learn all about snow science when they take a cruise to the North Pole to see a rainbow igloo that Pete the Polar Bear and C,0
phone,51,48,"Daddy Pig's car runs out of petrol but Granddad Dog's garage is not far away. With one phone call, Granddad Dog is on his way.",0
actually,51,49,Today is George's birthday and Mummy and Daddy Pig have a special day planned. George gets a new Brontosaurus toy and the family go to the m,1
sky,51,46,It is night time and the sky is fall of shining stars. Mummy and Daddy Pig let Peppa and George put their coats on over their pyjamas and go,0
seemingly,51,51,Peppa tries to learn how to whistle after she realises that seemingly everyone but her can do it.,0
double,51,50,"The British Bulldog, Double J, The Heavenly Bodies, and many more on this edition of Monday Night Raw.",0
settle,51,51,Razor Ramon and the 1-2-3 Kid look to settle their differences in the ring while another superstar looks to capitalize on their conflict.,0
quest,51,51,WWE Superstars continue their quest to become King of the Ring. Jim Cornette makes a perfect announcement. Brian Pillman signs with WWE.,0
odds,51,51,Bret Hart's newly adopted attitude continues to put him at odds with his fellow Superstars including WWE Champion Shawn Michaels. With manag,0
payback,51,50,A new Commissioner is appointed to teach a lesson in respect to The Hart Foundation. Shawn Michaels embraces a new attitude while earning a,0
val,51,51,"""Stone Cold"" Steve Austin faces Pat Patterson & Gerald Brisco in a Street Fight. As Dude Love must reckon with Dustin Runnels. The New Age O",0
risk,51,51,Triple H battles the Big Show for the WWE Championship in a No Disqualification Match. Stephanie McMahon-Helmsely puts a Superstar's job at,-1
rikishi,51,51,Mr. McMahon orders The Rock and The Undertaker to face each other in a Lumberjack Match main event. Shane McMahon battles Rikishi in a match,0
masters,51,49,"As the WWE Draft Lottery gets under away, Raw welcomes its newest addition that leaves the fans in awe. Batista and Triple H sign a contract",0
trial,51,50,Mr. McMahon presides over the trial of Eric Bischoff that could put an end to his tyrannical reign as Raw General Manager. Shawn Michaels &,0
mccool,51,51,"The November 3, 2008 Edition of RAW is a Professional wrestling television show of the WWE's RAW brand, which took place on November 3, 2008",0
dragons,51,50,"Tonight's episode of Raw is being broadcast live from the SAP Center in San Jose, CA. The scheduled matches for tonight’s card are:

Interco",0
manages,51,49,"Tired from Masha's endless games, the Bear pretends to be sick so she will leave him alone. But the caring girl is determined to cure her fr",0
cheating,51,50,"Kids love daydreaming and show off their imaginary successes, aren’t they?! Masha and Panda grip into a real cheating competition! This woul",-1
exam,51,45,Jake and Rosa go on a search mission after a stressed-out Amy disappears on the day of her sergeant's exam. Gina inherits a Boyle family hei,0
simon,51,47,"Groups unite their forces and converge on the Hilltop. Meanwhile, Aaron and Enid search for allies. Simon takes matters into his own hands.",0
reunite,51,51,"Daryl's daring rescue mission forces Alpha to unleash a group of her own to retrieve what belongs to her, even if the price is paid in blood",0
oden,51,30,Dogstorm and Cat Viper share their story of being on the journey with Oden and Roger but are interrupted by Nami who is concerned about the,0
andrew,51,50,"As Andrew falls under the spell of the randy Hormone Monster, his buddy Nick becomes obsessed with the lack of changes in his own body.",0
lilly,51,44,"After running away from the youth home “Seven Sleepers”, 16-year-old Lilly is found dead in a lake. Her boyfriend Pascal is missing. Investi",0
turbot,51,46,"While the pups are having a sleepover, the Lighthouse light runs out of power. Cap'n Turbot, the one who monitors the Lighthouse light, is o",0
smurf,51,48,"The Codys must deal with the aftermath of the heist, as they discover all did not go as planned. Smurf dispatches her boys to tie up loose e",0
pair,50,50,"Players pair off for the fourth game. Gi-hun grapples with a moral dilemma, Sang-woo chooses self-preservation and Sae-byeok shares her unto",0
sudden,50,50,"The games resume, and Gi-hun fixates on confronting Kang Dae-ho. Meanwhile, Kim Jun-hee faces a sudden crisis that pushes her willpower to i",0
theory,50,49,"Even after leaving Fujisawa for Ogaki, not one person remembered anything about Mai Sakurajima. Sakuta and Mai return to school together, bu",0
forward,50,50,"Sakuta had been unable to see Mai, who was not only busy with work but had an order from her agency forbidding her from going on dates. The ",0
movie,50,48,"With Nodoka's Puberty Syndrome resolved, Sakuta's expectations to spend sweeter times with Mai is growing. But then, a scandal is reported b",0
giving,50,50,"A poltergeist-like phenomenon attacks Ikumi. Sakuta is worried the attack was caused by Puberty Syndrome, but Ikumi claims that the only way",0
garden,50,48,A darling delivery leads to a garden adventure when Gabby and Pandy call on Kitty Fairy and crew to help grow and soothe an itty bitty bloss,0
fly,50,50,"Get ready to race, jump and fly as Gabby, Pandy, Carlita and the DooDads compete for a big, beautiful Meow-Mazing Games trophy!",0
gift,50,47,"Next stop: Birthday Island! In honor of Pandy’s big day, Gabby prepares a heartfelt gift, and the dollhouse friends celebrate with a series ",1
watch,50,49,"When Gabby and Pandy score party passes to DJ Catnip's music festival, they board a groovy bus to watch shows featuring all their favorite G",0
planned,50,47,"CatRat wants everything to be perfect for his grandma's visit. But when things don't go as planned, the day is full of new and exciting surp",0
stops,50,50,"It's raining and Peppa is sad because she can't play outside. When the rain stops, Peppa and George get to play one of their favourite games",0
strikes,50,50,"Daddy Pig winds up the old cuckoo clock in Peppa and George's bedroom. When the clock strikes the hour, a wooden bird pops out, flapping its",0
clean,50,47,"Daddy Pig hangs his clean football shirt out to dry, but Peppa, George and Mummy splash it with mud.",0
send,50,50,"Peppa and George go on a boat trip with Grandpa Pig, but they must send Polly Parrot for help when their boat runs aground.",0
mountain,50,48,"After a family trip to a mountain beauty spot, Daddy Pig loses the car keys down a drain.",0
dad,50,50,"Peppa and George are watching Detective Potatoes on TV. When Piggy Dad loses his car in the parking lot, Detective Potatoes shows up and hel",0
sights,50,50,"The Hart Foundation's anti-American crusade continues as they set their sights on Shawn Michaels. The British Bulldog goes one-on-one with """,0
vows,50,50,"With Mike Tyson now the newest member of DX, ""Stone Cold"" Steve Austin vows to take the show hostage until he comes face to face with Mr. Mc",0
remains,50,49,"On a special Raw Saturday Night, Mr. McMahon vows to end ""Stone Cold"" Steve Austin's reign as WWE Champion by announcing a master plan. The ",0
visitor,50,50,"While Mr. McMahon recuperates from his injuries in the hospital, Mankind surprises him with some special visitors to cheer him up. But as th",0
umaga,50,50,"When Mr. McMahon looks for a sign from above, Shawn Michaels shows him the meaning of ""seek and you shall find."" However, The Heartbreak Kid",0
emotional,50,50,"After retaining the WWE Championship at WrestleMania, Randy Orton finds himself faced with new challengers to his title before he goes one-o",0
hawkins,50,48,"Sheamus and Santino Marella vs. Wade Barrett and Jinder Mahal
Kofi Kingston vs. Daniel Bryan
""The Funkasaurus"" Brodus Clay vs. Curt Hawkins
",0
bond,50,48,"On Raw tonight, Charlotte defends her Women’s Championship against Bayley tonight in a Royal Rumble rematch, while Kevin Owens and Chris Jer",0
rousey,50,48,"Stephanie McMahon invited Ronda Rousey to Raw to clear the air after Rousey put her husband Triple H through a table. However, after the Raw",0
calling,50,49,"""The Fiend"" came calling again, Rey Mysterio defies the odds to secure massive title match on Raw's season premiere, a new 24/7 Champion is ",0
daring,50,48,Breaching one of the most high-security locations in New York puts Peter's skills to the test. Rose and Dr. Cole enact a daring plan to stop,0
complicated,50,50,"George Sr. and Georgie go camping with Connie's new boyfriend, Dale, but things get complicated when her ex-boyfriend, Dr. Sturgis, tags alo",0
uncovers,50,50,"Thrown into the deep end during his first week at the CIA, rookie lawyer Owen Hendricks quickly gets in over his head when he uncovers a pos",0
jesus,50,37,"Jesus Burgess of the Blackbeard Pirates tries to agitate Sabo, mocking Ace's final words in order to unsettle him enough that he can try to ",0
jerry's,50,46,George has doubts about his current relationship that he broke off. Elaine is curious about a relationship that she has with a guy in her bu,0
station,49,47,"While looking for the cause of Mai's Adolescence Syndrome, Sakuta ends up scheduling a date with Mai. On the day they promised, Sakuta tries",0
these,49,49,"Upon inducing a case of ""Puberty Syndrome"" where two copies of herself exists, Rio ends up staying at Sakuta's house for the time being. Mea",0
started,49,47,Sakuta has started attending university and meets a girl during a group outing.,0
box,49,42,"A fuzzy delivery contains a cuddly surprise for Baby Box. In the dollhouse, Gabby and Pandy attempt to keep up with some cute and crafty cri",0
magical,49,48,"Gabby and Pandy delight in a day of pirate-themed adventures, featuring music, maps and magical travel. Cakey leads a tasty treat tutorial.",0
complete,49,49,"As Floyd snuggles up for bedtime, Gabby, Pandy and Pillow Cat prepare for a sleepover in Kitty Fairy’s garden, complete with a magical pajam",0
tree,49,45,"As Floyd snuggles up for bedtime, Gabby, Pandy and Pillow Cat prepare for a sleepover in Kitty Fairy’s garden, complete with a magical pajam",0
cousin,49,47,"It's cousin time; Bakey, Flakey, Marshapan, and Paddycake visit Cakey and the dollhouse gang for a ""sprinkle-rific"" day of yummy snacks and ",0
teach,49,49,"The Box Family welcomes its newest member: Benny Box! When Mama Box needs a nap, Gabby and Pandy teach Baby Box how to babysit her new broth",0
fruit,49,46,"Peppa and her family go to the shops for some tomatoes, spaghetti, onions and fruit, but Daddy Pig gets some chocolate cake too.",0
cake,49,42,"Peppa and her family go to the shops for some tomatoes, spaghetti, onions and fruit, but Daddy Pig gets some chocolate cake too.",0
nature,49,47,"Peppa and her family follow a nature trail in the countryside, discovering footprints left by little birds and ants.",0
large,49,48,Peppa and her family are driving in a large campervan across America. They stop at a diner and meet another Miss Rabbit.,0
plot,49,48,Bret 'The Hitman' Hart returns and makes some stunning proclamations about his WWE future. Hunter Hearst Helmsley reveals a perfect plot.,0
position,49,49,"As dissension continues to build within The Corporation, Paul Wight and WWE Champion The Rock put aside their differences to take on ""Stone ",0
matters,49,49,"""Stone Cold"" Steve Austin looks to reclaim a piece of his property. The Ministry of Darkness steals something precious to Mr. McMahon. With ",0
cool,49,48,"Stephanie McMahon and Test plan to tie the knot and spend the rest of their lives in wedded bliss, but Triple H doesn't hold his peace. Kane",0
bar,49,48,Rob Van Dam challenges WWE Undisputed Champion The Undertaker for the gold. After being put out-of-action on the orders of WWE Co-Owner Ric,0
rival,49,49,Mr. McMahon drops a bombshell on the WWE Universe when he introduces a former rival as the new General Manager of Raw. Brock Lesnar teams wi,0
capture,49,48,"With Edge using his Money in the Bank Contract to capture the World Heavyweight Championship from The Undertaker, The Rated-R Superstar bids",0
nightmare,49,47,"Despite his victory over The Great Khali at Judgment Day, WWE Champion John Cena's problems with the Punjabi Nightmare are far from over. Be",-3
hornswoggle,49,49,On a night where John Cena's father tries to protect his son from being stripped of the WWE Championship by agreeing to face Randy Orton in,0
military,49,47,"On a very special Tribute to the Troops, the Superstars of RAW journey to Iraq to perform for members of the U.S. Military. From WWE Champio",0
eye,49,46,"Like a runaway sailboat careening toward SummerSlam, Team WWE fought and flailed as if in the eye of the storm. With just six days left, how",0
torres,49,48,"Daniel Bryan vs. Cody Rhodes
Wade Barrett vs. Santino Marella
The Miz vs. Sheamus
WWE Championship
CM Punk vs. Dolph Ziggler
The Bella Twins",0
nia,49,46,"On Raw tonight, Charlotte defends her Women’s Championship against Bayley tonight in a Royal Rumble rematch, while Kevin Owens and Chris Jer",0
ronda,49,48,"Stephanie McMahon invited Ronda Rousey to Raw to clear the air after Rousey put her husband Triple H through a table. However, after the Raw",0
maggie,49,47,Edward Mordrake continues his search for a Freak to add to his ghostly coterie. Elsa tells the grisly story of her days in Germany. Jimmy an,0
spread,49,46,"Bright summer day. Bear, while gathering berries, meets female bear in the woods and arranges a date. Returning home, he starts cleaning the",0
piccolo,49,46,"Piccolo may have a way to stop Raditz - the Makankosappo! There’s only one problem. He needs time to gather energy for the blast, which mean",0
sawyer,49,40,"Jack and Hurley discover an alarming secret about Kate, as the marshal's life hangs in the balance and he suffers a lot of pain. Meanwhile K",0
gather,48,48,"New players gather for a chance to win 45.6 billion won. After an intense first round, the survivors' fates hang in the balance — down to on",0
held,48,48,"Sakuta has a dream that Mai reveals herself as the true identity of Touko Kirishima at a music festival held on April 1st. At the same time,",0
treat,48,46,"As Floyd settles in for a tasty treat, Gabby grabs a new piece of mail from the Meow Meow Mailbox and prepares for an action-packed day at k",0
board,48,47,"When Gabby and Pandy score party passes to DJ Catnip's music festival, they board a groovy bus to watch shows featuring all their favorite G",0
trail,48,47,"Follow the candy trail? No problem! Kitty-tine's Day leads to treats, songs and crafts as Gabby and friends find creative ways to say ""I meo",0
announces,48,47,"Suzy Sheep has come to play with Peppa, and has made up a pretend friend called 'Leo Lion'. Peppa cannot see Leo but Suzy announces that Leo",0
morning,48,48,"Peppa and George wake up one morning to find that all the rain has made a flood, and their house is now a desert island!",0
judge,48,45,"Playgroup is having a pet competition and everyone has brought their pets. Dr Hamster is the judge, but it is so hard to choose the best pet",0
walk,48,42,Peppa and her family go on a walk through the forests where they meet all their favourite fairytale characters.,0
words,48,48,"On a day out with her family, Peppa is encouraged to find words to describe the different kinds of puddles they find.",0
moments,48,48,Peppa explores special moments of togetherness with friends who are special to us.,0
reign,48,48,"Following WrestleMania XII, the new WWE Champion Shawn Michaels kicks off his inaugural title reign. Mankind makes his unforgettable debut.",0
considers,48,48,"Shawn Michaels and his pals disrupt order in WWE, but Commissioner Slaughter gets the last laugh as he forces Hunter Hearst Helmsley to batt",0
owner,48,46,"Shawn Michaels and his pals disrupt order in WWE, but Commissioner Slaughter gets the last laugh as he forces Hunter Hearst Helmsley to batt",0
charlie,48,47,"Boxing Legend Mike Tyson is announced as the guest enforcer for the ""Stone Cold"" Steve Austin vs. Shawn Michaels match at WrestleMania. Paul",0
efforts,48,48,Mr. McMahon seeks retribution on The Undertaker by forcing him to face Kane in an Inferno Match. Mankind's efforts to capitalize on the tens,0
angry,48,48,"With a giant ash cloud hovering over Europe, thanks to an erupting volcano in Iceland, air travel has been severely restricted, causing most",-1
seven,48,47,"One night after the seven season one NXT Rookies decimated the WWE landscape at Fatal 4-Way, the pugnacious pack once again tore into the Ra",0
central,48,47,"Buckle up, hold on and expect the unexpected. While Central Florida may be the epicenter of theme parks and wild rides, the WWE Universe was",0
primo,48,47,"Tag Team Match

Air Boom (Evan Bourne and Kofi Kingston) vs. The Colons (Epico and Primo) w/ Rosa Mendes

United States Championship Match

",0
learned,48,45,"Kevin Owens, Dean Ambrose, Cesaro, Sami Zayn, and Chris Jericho qualified for this year’s Money in the Bank Ladder Match, where they’ll batt",0
bayley,48,46,"On Raw tonight, Charlotte defends her Women’s Championship against Bayley tonight in a Royal Rumble rematch, while Kevin Owens and Chris Jer",0
sparks,48,48,Sparks fly as Paul and Zion's families join the Millers for a holiday dinner. Austin looks for his Christmas gifts — and makes a dangerous f,0
debra,48,47,"Dexter's world is rocked when a rival serial murderer, dubbed the Ice Truck Killer by the media, privately contacts him and reveals that he ",0
suicide,48,43,"The strange suicide of a powerful woman leads Dexter to suspect her shrink of murder, but he gets a shock when a visit to the suspect opens ",-3
lei,48,24,Shan Cai was unhappy on her first day at the Ying De University. She didn't like her coward instructors and her rich and arrogant classmates,0
oars,48,19,"With Luffy's shadow, Moria and his followers head into the freezer holding his ultimate special zombie that he believes will help him gain p",0
cap'n,48,47,"While the pups are having a sleepover, the Lighthouse light runs out of power. Cap'n Turbot, the one who monitors the Lighthouse light, is o",0
eleanor,48,43,"Devi allows rumors about her and Paxton to swirl during an overnight school trip. Fabiola opens up to Eleanor, who gets upsetting news about",0
upper,47,44,"No-eul tries to gain the upper hand in negotiations, but her plans backfire. Gi-hun faces a moral crossroads, testing his limits — how far w",0
else,47,47,"Puberty syndrome – Abnormal experiences rumored on the internet to be caused by sensitivity and instability during adolescence. This year, S",0
searching,47,47,"Upon searching the hashtag #DREAMING, numerous posts were found about attending a middle school reunion on November 27th. Ikumi also dreamt ",0
state,47,45,"Mai responds to the media, asserting that she is not the real identity of Touko Kirishima on Coming of Age Day. Nevertheless, the impact of ",0
hatch,47,44,"Gabby and Pandy practise patience as they wait for a super cute egg to hatch; luckily, Kitty Fairy, MerCat and DJ Catnip are there to lend h",0
rabbit,47,43,Rebecca Rabbit has a little brother called Richard who is the same age as George.,0
cannot,47,44,"Suzy Sheep has come to play with Peppa, and has made up a pretend friend called 'Leo Lion'. Peppa cannot see Leo but Suzy announces that Leo",0
underground,47,45,"There is a new girl at school, and she quickly makes best friends with Peppa and Rebecca Rabbit. Molly shows them how good she is at digging",0
terry,47,44,"After his match with El Matador, Ric Flair issues a career changing challenge to Mr. Perfect for Raw next week. WWE Champion Bret Hitman Har",0
president,47,46,"Jim Cornette's newest client delivers a message to President Gorilla Monsoon. Plus, Bret Hart faces Goldust in the main event, and more.",0
winning,47,47,"The Undertaker looks to lay Salvatore Sincere's winning streak to rest. Plus, The Intercontinental Title Tournament continues and much more!",0
strike,47,46,"Bret Hart defends his newly-won WWE Championship against Sycho Sid. But before the ""Hit Man"" can face this tall order, ""Stone Cold"" Steve Au",0
weapon,47,47,"Bret Hart defends his newly-won WWE Championship against Sycho Sid. But before the ""Hit Man"" can face this tall order, ""Stone Cold"" Steve Au",0
tommy,47,41,"Back where it all began in New York City's famed Manhattan Center, Monday Night Raw gets hardcore as ECW invades WWE. In response to Jerry """,0
interest,47,47,"After DX's reenactment of Survivor Series comes up short, WWE Champion Shawn Michaels makes a special offer to Jim ""The Anvil"" Neidhart. The",0
becoming,47,45,"Mr. McMahon lets the WWE Universe know exactly what he thinks of ""Stone Cold"" Steve Austin possibly becoming the WWE Champion. Billy Gunn ta",0
linda,47,47,"After announcing a No Holds Barred Free-For-All Match between The Rock, Mankind, The Undertaker, Kane, and the Big Show to determine the No.",0
confronted,47,46,"The Rock's victory in the Royal Rumble is called into question when he is confronted by the Big Show. Plus, Triple H, Kane, and more!",0
machine,47,42,After CEO Linda McMahon announces that The Rock will join forces with Kane and The Undertaker to face the McMahon-Helmsley Faction at King o,0
current,47,47,"""Stone Cold"" Steve Austin addresses the current state of WWE before continuing his search for payback on whoever ran him over at the 1999 Su",0
hours,47,43,"Just 24 hours after winning the 2002 Royal Rumble Match, Triple H begins his road to WrestleMania by teaming with The Rock to take on Kurt A",0
sunday,47,46,Triple H faces Randy Orton. Mr. McMahon gathers ECW Champion Big Show and World Heavyweight Champion Booker T together with WWE Champion Joh,0
jtg,47,47,"The September 8, 2008 Edition of RAW is a Professional wrestling television show of the WWE's RAW brand, which took place on September 8, 20",0
experience,47,46,"As a singer of sinister songs and a director of horror films, Raw special guest host Rob Zombie has experience with the darker side of human",0
kingdom,47,45,"Before the American Revolution began in 1774, the kingdom of Great Britain assumed they had their American subjects squarely under thumb. An",0
marie,47,46,"Tonight's episode of Raw is being broadcast live from the Staples Center in Los Angeles, CA. The scheduled matches for tonight’s card are:

",0
mizdow,47,46,"Tonight's episode of Raw is being broadcast live from the Honda Center in Anaheim, CA. The scheduled matches for tonight’s card are:

Single",0
cut,47,46,"Saving Raw General Manager Mick Foley from annihilation at the hands of Triple H, a seemingly recovered Seth Rollins emerged to get some pay",0
asuka,47,46,"On the first live Christmas episode of Raw, unlikely partners Seth Rollins & Jason Jordan captured the Raw Tag Team Titles. Plus, John Cena ",0
liv,47,46,"On the final Raw of 2019, Lana and Bobby Lashley's wedding was left in ruin following the shocking confession from returning Liv Morgan and ",0
damian,47,47,WWE Champion Bobby Lashley returns. Drew McIntyre & Braun Strowman take on MACE & T-BAR. Sonya Deville uses her power to make a surprising d,0
behavior,47,47,"After a sudden behavior change raises concern among his friends, Marcus has a tearful meeting with Ginny. Austin witnesses a terrifying scen",0
revelations,47,47,"As Gil continues to make threats and Cordova closes in, revelations about Georgia's past surface at the worst possible time.",0
investigating,47,46,"While investigating a string of hotel robberies together, Jake discovers that Amy may transfer to the Major Crimes unit and work with ""The V",0
paris,47,43,"Hua Zhe Lei was dissapointed to hear Jing's announced in her party that she was leaving for Paris to pursue her dream. The next day, Shan Ca",0
