token,freq,df,sample,weight
ahead,70,70,"Ahead of the last round, distrust and disgust run deep among the finalists. Jun-ho makes a getaway, determined to expose the game's dirty se",0
answers,70,70,"Puberty syndrome – Abnormal experiences rumored on the internet to be caused by sensitivity and instability during adolescence. This year, S",0
beach,70,68,"While looking for the cause of Mai's Adolescence Syndrome, Sakuta ends up scheduling a date with Mai. On the day they promised, Sakuta tries",0
role,70,69,"Because of the misunderstanding that she was dating Sakuta, Tomoe is able to resolve the agonizing situation of being asked out by the guy h",0
reunion,70,68,"A pumpkin lantern made of glass comes crashing down in a plaza in front of Sakuragicho Station, just as a social media post with the hashtag",0
possible,70,70,"Sakuta from the other possible realm sends a message through Ikumi that reads, “Find Touko Kirishima, Mai-san is in danger.” After seeing th",0
skills,70,66,"Gabby and Pandy unbox their first surprise, show off their shrinking skills and take to the dollhouse for a meowt-of-this-world mission.",-3
detective,70,66,"Mr Dinosaur is George's favourite toy. When Mr Dinosaur goes missing, George is distraught. Daddy Pig helps Peppa to become a detective and ",0
pirate,70,66,"Grandpa and Granny Pig take Peppa, George and all their friends on a boat trip to Pirate Island. On the island, Grandpa shows everyone how t",0
clay,70,70,"Mrs Zebra teaches Peppa, George, Zoe, Zaza and Zuzu Zebra how to make a real tea set from clay.",0
palace,70,65,"Miss Rabbit is to be given the Queen's Award for Industry, and Peppa and her friends are to accompany her to the palace to meet the Queen!",0
nothing,70,69,"Peppa and Suzy are bored because they have nothing to do, so Daddy Pig finds them an old box of garden games to play with. But not all the g",0
trapped,70,70,"It's Pedro Pony's Birthday, which turns out to be super when Miss Rabbit is trapped on a giant balloon!",-1
adam,70,64,Doink the Clown faces off against Mr. Perfect in singles action. Razor Ramon discusses a rematch with The Kid and even offers him money to c,0
foley,70,67,"With ""Stone Cold"" Steve Austin's spot in the main event at WrestleMania now secured, Mr. McMahon looks to make the show even bigger by revea",0
those,70,68,"The identity of the ""Greater Power"" is revealed. ""Stone Cold"" Steve Austin is given his own position of authority. With the tide now turned,",0
romantic,70,68,"Mr. McMahon orders ""Stone Cold"" Steve Austin and Triple H to team up to compete against The Rock and WWE Champion Kurt Angle in the main eve",2
potential,70,70,"With the WWE Universe being given the opportunity to decide who will face Triple H for the World Heavyweight Championship at Taboo Tuesday, ",0
flock,70,67,"As The Wyatt Family attempted to dominate Big Show after Raw’s main event, Ryback and Demon Kane entered the fray to even the odds against t",0
colleague,70,69,"Sheldon attempts to build a nuclear reactor. Also, a university cocktail party gets heated when Dr. Sturgis’ colleague, Dr. Linkletter, flir",0
harry,70,68,A quick fix for Harry's writer's block has unexpected side effects. Two eccentric locals offer Harry a helping hand.,0
sex,70,58,"Liza struggles with the anxiety of sex with Josh and gets a little help from Maggie. At work, Kelsey pulls out all the stops to land a hot n",0
brook,70,58,"In search of food, the Straw Hats attempt octopus hunting before discovering a barrel in the middle of the ocean. After opening the barrel, ",0
deep,69,69,"Ahead of the last round, distrust and disgust run deep among the finalists. Jun-ho makes a getaway, determined to expose the game's dirty se",0
facing,69,67,"Gi-hun finally gets hold of an invitation, marked for Halloween day. In a tense moment facing Jun-ho, they reveal their truths to each other",0
believes,69,66,"A pumpkin lantern made of glass comes crashing down in a plaza in front of Sakuragicho Station, just as a social media post with the hashtag",0
contest,69,69,"A poltergeist-like phenomenon attacks Ikumi. Sakuta is worried the attack was caused by Puberty Syndrome, but Ikumi claims that the only way",0
gabby,69,63,"Gabby and Pandy unbox their first surprise, show off their shrinking skills and take to the dollhouse for a meowt-of-this-world mission.",0
course,69,69,"While completing an obstacle course to become superheroes, Gabby and Pandy learn how to use their bodies — as well as their minds!",0
playing,69,66,"After Gabby finds a box of paper cups, the friends get creative making paper cup animal crafts, telling stories and playing fur-tastic games",0
treasure,69,55,Gabby and Pandy follow clues and solve riddles to find sparkly treasures on an a-meow-zing Dollhouse Treasure Hunt. Can they find all three?,0
idea,69,67,"Pillow Cat can't sleep, so the gang tries to help. Cakey makes a bedtime snack, DJ Catnip spins ""The Yawn Song"" — but CatRat's idea might do",0
ride,69,65,Peppa Pig and George decide it is a great day to go and ride bicycles while Daddy Pig is admiring a prize-winning pumpkin he has. However Pe,0
farm,69,66,Peppa and friends visit a Petting Farm where they enjoy feeding chickens and meeting cute and squeaky guinea pigs and they all learn it's im,0
advantage,69,68,Randy Orton takes advantage of his rematch clause by challenging Triple H for the WWE Championship. After winning the King of the Ring Tourn,0
thought,69,64,It’s been said that the road to hell is paved with good intentions. Whoever thought up that must have never watched Raw. There are a galaxy,0
uncover,69,68,Rose and Peter seek out one of the Campbells' recent contacts and uncover new intel. Monks opens up to Chelsea. Paulo makes a move on Maddie,0
jay,69,66,"The Waves are on a winning streak — until Jay disappears after an unexpected outburst, forcing Isla to go in search of him.",0
marinette,69,64,"A fellow student with a crush on Marinette is akumatized into the Evillustrator, a villain that Cat Noir must face without Ladybug.",0
female,68,63,A Miniskirt Santa suddenly appears before Sakuta. She says her name is “Touko Kirishima” and claims to have been handing out Puberty Syndrom,0
leading,68,68,"Sakuta has a dream that Mai reveals herself as the true identity of Touko Kirishima at a music festival held on April 1st. At the same time,",0
share,68,67,It’s time for another dollhouse delivery! Gabby and Pandy share their new Meow Meow Mail with Cakey and work on a cure for a sneaky case of,0
ball,68,59,"The grass has grown so long that Peppa and George's ball gets lost in it. It falls to Grandpa to save the day with Betsy, his motorised lawn",0
already,68,67,Madame Gazelle has to go to the dentist so she leaves the class with Mr. Bull. The children already know the subjects Mr. Bull suggests teac,0
disqualification,68,67,"Bret Hart's new attitude puts him at odds with WWE Champion Shawn Michaels. With managers barred from ringside, ""Wildman"" Marc Mero takes on",-1
opponent,68,68,"""Stone Cold"" Steve Austin defends his WWE Championship against a bizarre opponent. WWE cameras go to the front lines as DX takes the war to ",0
assault,68,67,"Mr. McMahon learns that even he isn't above the law when ""Stone Cold"" Steve Austin teaches him a lesson in hard time, but the boss may have ",0
michelle,68,66,"While preparing to go one-on-one with Edge, Batista's attention turns to SmackDown's WWE Champion John ""Bradshaw"" Layfield who's impending a",0
wilson,68,60,"The rivalry between The McMahons and DX continues, as Shawn Michaels takes on Shane McMahon. While Mick Foley continues to deny Ric Flair's ",0
contendership,68,57,"The October 6, 2008 Edition of RAW is a Professional wrestling television show of the WWE's RAW brand, which took place on October 6, 2008 a",0
stardust,68,68,"Tonight's episode of Raw is being broadcast live from the Quicken Loans Arena in Cleveland, OH. The scheduled matches for tonight’s card are",0
sasha,68,65,"Tonight's episode of Raw is being broadcast live from the Sprint Center in Kansas City, MO. The scheduled matches for tonight’s card are:

S",0
survivors,68,59,"The end of the world happens when the bombs drop, and the survivors wonder if surviving is worth it after the Cooperative gives them shelter",0
immediately,68,62,"The Bear goes fishing. In anticipation he slings his fishing rod but as soon as the first fish swallows the bait, Masha appears and transfor",0
steal,68,65,"For their annual Halloween wager, Jake bets Holt that he can steal his watch before midnight, and Gina gets kicked off her dance squad, Floo",-1
andy,68,64,Michael decided to send his employees out into the field for sales calls. He paired himself up with Andy. He let the veterans choose who the,0
unusual,67,67,"Puberty syndrome – Abnormal experiences rumored on the internet to be caused by sensitivity and instability during adolescence. This year, S",0
attend,67,67,"Unable to deal with a commercial filming well as the actress Mai Sakurajima, Nodoka gradually starts to feel a strong sense of inferiority. ",0
they're,67,66,"A glowing lantern leads Gabby and Pandy to a Fairy Fly House! But to meet their new neighbor, they'll need to prove they're helpful, kind an",0
camp,67,66,"Pedro Pony pretends he is a proper cowboy, telling everyone stories in the camp he has set up in the garden.",0
interview,67,67,"As the road to WrestleMania IX continues, Papa Shango competes against the former WWE Champion, Bob Backlund. Bobby ""The Brain"" Heenan condu",0
superstar,67,62,The 1993 WWE Superstar of The Year is revealed. Razor Ramon faces Diesel. Bam Bam Bigelow is in action.,0
throws,67,67,"Several Raw Superstars including Chris Jericho, Triple H, Shelton Benjamin, and more try to earn the best spot in the upcoming Elimination C",0
security,67,63,"Tonight's episode of Raw is being broadcast live from the U.S. Bank Arena in Cincinnati, OH. The scheduled matches for tonight’s card are:

",0
field,67,66,"The Boss is back in charge! In a thrilling main event battle, Sasha Banks made Charlotte submit to the Banks Statement to become a two-time ",0
pope,67,63,"Escaping from walkers, Connie and Virgil hide in a house occupied by mysterious creatures. Pope tests Daryl's loyalty to the Reapers with a ",0
spend,66,66,"Puberty syndrome – Abnormal experiences rumored on the internet to be caused by sensitivity and instability during adolescence. This year, S",0
towards,66,63,"While looking for the cause of Mai's Adolescence Syndrome, Sakuta ends up scheduling a date with Mai. On the day they promised, Sakuta tries",0
invites,66,66,"Upon searching the hashtag #DREAMING, numerous posts were found about attending a middle school reunion on November 27th. Ikumi also dreamt ",0
create,66,66,"Tall tales come to life with a king, a mermaid and so much more as Gabby and the gang create and celebrate enchanting fairytales in a storyb",0
follow,66,65,Gabby and Pandy follow clues and solve riddles to find sparkly treasures on an a-meow-zing Dollhouse Treasure Hunt. Can they find all three?,0
used,66,66,"Peppa and George have fun blowing bubbles. When the mixture is used up, Daddy Pig makes his own.",0
club,66,62,"Suzy and Peppa start a secret club, but soon everyone wants to join!",0
james,66,65,Brian Pillman reveals a more spiritual side of himself when he sides with The Hart Foundation. The British Bulldog faces WWE Champion The Un,0
witness,66,63,Witness one of the most epic events in sports entertainment history as WWE owner Vince McMahon announces that he's purchased WCW in this his,0
angeles,66,64,"Tonight's episode of Raw is being broadcast live from the Staples Center in Los Angeles, CA. The scheduled matches for tonight’s card are:

",0
staff,66,64,"Three concurrent surgeries at the hospital push its staff to the limits. Determined to ease the pressure, Nic requests Jude for one of the o",0
runway,66,57,The remaining girls have to learn to walk down a fashion runway. The fashion shoot is one for Stuff men's magazine where the girls pose in s,0
moment,65,63,"Gi-hun finally gets hold of an invitation, marked for Halloween day. In a tense moment facing Jun-ho, they reveal their truths to each other",0
seeing,65,64,"Even after leaving Fujisawa for Ogaki, not one person remembered anything about Mai Sakurajima. Sakuta and Mai return to school together, bu",0
age,65,65,"Mai responds to the media, asserting that she is not the real identity of Touko Kirishima on Coming of Age Day. Nevertheless, the impact of ",0
truck,65,63,"Carlita has transformed into an ice cream truck! Before she can deliver sweet treats to all the Gabby Cats, she'll need ice cream, a menu an",0
mummy,65,59,"It's raining and Peppa is sad because she can't play outside. When the rain stops, Peppa and George get to play one of their favourite games",0
rules,65,62,"Peppa's older cousin Chloe comes to visit, and Peppa must play games by somebody else's rules for a change.",0
lot,65,64,Peppa's Playgroup have a new friend to meet - Mandy Mouse. Mandy uses a wheelchair. The children have a lot of fun playing with Mandy as she,0
six-man,65,65,"""Stone Cold"" Steve Austin looks for payback on Dude Love. As The Undertaker looks to settle the score with Kane, Kane and Paul Bearer make a",0
level,65,63,"The Undertaker, Kane, and Mankind compete in a No. 1 Contender's Match for the WWE Championship. DX takes their problems with The Nation to ",0
justin,65,63,"Chris Jericho issues a challenge to ""Stone Cold"" Steve Austin for his WWE Championship, however, Y2J learns that you can't always get what y",0
chavo,65,62,The rivalry between Edge and John Cena over the WWE Championship continues to heat up but the relationship between Lita and Edge gets even h,0
diego,65,65,"Tonight's episode of Raw is being broadcast live from the Pepsi Center in Denver, CO. The scheduled matches for tonight’s card are:

Singles",0
alive,65,64,"When a teacher is left fighting for her life, her doting husband signs her up for a high-tech system that keeps her alive — but at a cost.",1
luffy's,65,63,"Kuro's ultimate attack, ""Shakushi"", attacks everything in the area, whether friend or foe, and Luffy becomes enraged by his lack of regard f",0
saiyan,65,63,"Raditz has kidnapped Gohan, and unless Goku agrees to join the sinister Saiyan, he may never see his son again! All hope is not lost, howeve",0
krillin,65,61,"Korin wants Krillin, Yamcha, Tien, and Chiaotzu to report for special training! Meanwhile, Gohan’s grueling training causes him to undergo a",0
round,64,52,"Hoping to win easy money, a broke and desperate Gi-hun agrees to take part in an enigmatic game. Not long into the first round, unforeseen h",0
key,64,63,"No-eul infiltrates a dangerous operation with a risky plan. A new game is announced: hide-and-seek, where one group holds a key and the othe",0
eyes,64,64,A Miniskirt Santa suddenly appears before Sakuta. She says her name is “Touko Kirishima” and claims to have been handing out Puberty Syndrom,0
joey,64,59,"Peppa and George meet Kylie Kangaroo and her brother Joey. Peppa shows Kylie how to jump up and down in muddy puddles, but who can jump the ",0
kill,64,62,"With Mr. McMahon's plans of bringing in the New World Order to kill his own company causing a stir within the locker room, WWE Co-Owner Ric ",-3
goldberg,64,60,Shawn Michaels serves a special guest referee for a WrestleMania XIX rematch between Booker T and World Heavyweight Champion Triple H. As hi,0
finlay,64,64,"Shawn Michaels & Triple H take on Umaga and WWE Champion Randy Orton. Weeks of insulting ""Stone Cold"" Steve Austin's acting ability leave Sa",0
kaitlyn,64,62,"Match #1: Kane vs Alberto Del Rio

 Match #2: Daniel Bryan, Sin Cara & Ezekiel Jackson vs Cody Rhodes, Ted DiBiase & Ezekiel Jackson

 Match",0
professor,64,62,"Sheldon's first day of college is derailed by his new philosophy teacher, Professor Ericson. Also, Mary and Brenda live vicariously through ",1
inspector,64,49,"Robin and Usopp both disguise themselves as the same visiting inspector,  and Usopp is thrown in the brig with Zoro. Luffy and Sanji are  di",0
guys,63,61,"Sakuta dreams that on Christmas Eve, when he is meant to have a sleepover date with Mai, he instead goes on a date with a student named Sara",0
public,63,61,"Sakuta has a dream that Mai reveals herself as the true identity of Touko Kirishima at a music festival held on April 1st. At the same time,",0
who's,63,61,"On a rainy day, Gabby and friends must take care of Kico — a baby KittyCorn who's part kitty, part unicorn — until it's time for her to meet",0
keeps,63,62,"Peppa and George go ice skating, but they have never been before and Peppa keeps falling over.",0
doctor,63,60,Doctor Hamster the vet comes to Peppa's playgroup to show the children her pets.,0
wake,63,61,"Peppa and George wake up one morning to find that all the rain has made a flood, and their house is now a desert island!",0
pay,63,62,"Peppa and George pay a visit to Father Christmas. Peppa asks for a very special doll as a present, but will Santa be able to deliver it to h",0
energy,63,59,"Peppa and his friends arrive at school early to have breakfast together. In the breakfast club, they learn about how food gives energy and t",1
demands,63,63,Shawn Michaels defends the Intercontinental Championship against Hacksaw Jim Duggan. Captain Lou Albano returns to WWE television. Bob Backl,0
court,63,62,Yokozuna is Jerry Lawler's guest in the King's Court. What does the future hold for Yokozuna as he prepares to battle Hulk Hogan for the WWE,0
mick,63,63,"""Stone Cold"" Steve Austin faces The Artist Formerly Known as Goldust. With Triple H out of action due to a knee injury, Commissioner Slaught",0
legendary,63,62,Raw General Manager Eric Bischoff drops a bombshell on the WWE Universe by inviting a former adversary to return at No Way Out. One of the m,0
serious,63,62,"While it’s Raw guest host Mark Feuerstein who stars in USA Network’s Royal Pains, it was Raw’s General Manager, Bret Hart, who experienced s",0
opens,63,62,"Alexa Bliss continues down a dark road. Dominik Mysterio opens up about his time in prison on ""Miz TV."" New challengers to the Undisputed WW",0
operation,62,61,"No-eul infiltrates a dangerous operation with a risky plan. A new game is announced: hide-and-seek, where one group holds a key and the othe",0
crisis,62,60,"The games resume, and Gi-hun fixates on confronting Kang Dae-ho. Meanwhile, Kim Jun-hee faces a sudden crisis that pushes her willpower to i",-2
hiding,62,62,"When Gabby receives a fishbowl in her Meow Meow Mailbox, CatRat wants to use it as a home for his itty bitty kittyfish. But they keep hiding",0
isn't,62,62,"For Captain Daddy Dog's birthday, Mummy Dog surprises him with her present of a boat trip on a 'Canal Boat', which isn't quite what he was e",0
proves,62,62,Mummy Pig is persuaded by Miss Rabbit to come along to her relaxation class to help Mummy Pig relax but actual relaxing proves to be more ch,1
weeks,62,62,"With Wrestlemania IX just a few weeks away, Bret ""The Hitman"" Hart competes against Fatu. Doink The Clown battles ""The Birdman"" Koko B. Ware",0
loss,62,62,Can Razor Ramon avenge his upset loss to The Kid? Marty Jannetty faces Doink the Clown in a 2-out-of-3 Falls Contest.,-2
wcw,62,46,DX looks to cause dissension in The Hart Foundation. The Undertaker insists that he will never fight his brother Kane. Following a lackluste,0
hostage,62,60,"With Mike Tyson now the newest member of DX, ""Stone Cold"" Steve Austin vows to take the show hostage until he comes face to face with Mr. Mc",-2
effort,62,62,"""Stone Cold"" Steve Austin defends his WWE Championship against a bizarre opponent. WWE cameras go to the front lines as DX takes the war to ",0
trish,62,62,"While the rivalry between Triple H and Chris Jericho continues to escalate, Women's Champion Stephanie McMahon plans a special surprise for ",0
mercury,62,57,Shawn Michaels' personal rivalry with Edge leads The Heartbreak Kid into a main event Street Fight against The Rated-R Superstar. After mock,0
rodriguez,62,60,Match #1: John Morrison & Alex Riley vs Dolph Ziggler & Jack Swagger Match #2: Kofi Kingstonvs The Miz Match #3: Jerry Lawler & Sheamus vs D,0
brodus,62,62,"Sheamus and Santino Marella vs. Wade Barrett and Jinder Mahal
Kofi Kingston vs. Daniel Bryan
""The Funkasaurus"" Brodus Clay vs. Curt Hawkins
",0
wanted,62,56,"Braun Strowman wanted The Big Dog and, well, he got him. After demanding a confrontation with Universal Champion Roman Reigns, The Monster A",0
arrived,62,59,"In Raw’s turbulent main event, Sami Zayn and Matt Riddle arrived on Raw from a travel delay just in time to help Kevin Owens repel a 3-on-1 ",0
moira,62,60,Vivien learns the horrific truth about the house's first residents and Ben's visitor causes him to further unravel about what really happene,0
sam,62,60,Daniel spends some father-daughter time with a traumatized Sam. Johnny plans to form a new karate dojo but struggles to come up with a cool,0
couples,62,62,"Reeling from Nick's confession, the other couples must decide whether to reveal the truth to Anne before she suffers a public embarrassment.",0
majin,62,51,The Z-Fighters race to stop Babidi’s cronies from delivering the pure energy that will be used resurrect the dreaded Majin Buu. Will they fi,0
games,61,59,"The games resume, and Gi-hun fixates on confronting Kang Dae-ho. Meanwhile, Kim Jun-hee faces a sudden crisis that pushes her willpower to i",0
dates,61,55,"Sakuta had been unable to see Mai, who was not only busy with work but had an order from her agency forbidding her from going on dates. The ",0
holiday,61,59,"Gabby and friends go all out for an extra special holiday, throwing a ""paw-tastic"" party, complete with homemade decorations and dessert.",0
animal,61,59,"Gabby, Pandy and their curious crew set out on an animal safari to find a mysterious creature.",0
stuck,61,60,Gabby and Pandy blast off to Planet Caturn after CatRat gets stuck there looking for space cheese.,0
present,61,60,Santa Kitty is on his way to the Mermaid Christmas Cruise to give the first present of the year to MerCat's baby sister Hsiu Hsiu — and we'r,0
teaches,61,60,"Benny Box has a big smile — and his first tooth! After Kitty Fairy teaches Benny how to use a toothbrush, it's party time with a special gue",0
destruction,61,61,Yokozuna's path of destruction continues when he battles Crush. Tatanka battles it out with New York's own Brooklyn Brawler.,-1
debut,61,60,Earthquake and Adam Bomb face off in a WrestleMania X rematch. The debut of Shawn Michaels' Heartbreak Hotel and much more!,0
piper,61,61,"WWE pays the piper as they introduce the new acting president. Shawn Michaels faces Yokozuna in the main event. Plus, Diesel, and many more.",0
short,61,60,"After DX's reenactment of Survivor Series comes up short, WWE Champion Shawn Michaels makes a special offer to Jim ""The Anvil"" Neidhart. The",0
handle,61,61,"""Stone Cold"" Steve Austin addresses the current state of WWE before continuing his search for payback on whoever ran him over at the 1999 Su",0
pursuit,61,60,The NWO promises to reveal a shocking surprise that will change the very nature of Raw. The Undertaker's pursuit for the WWE Undisputed Cham,0
cloud,61,59,"With a giant ash cloud hovering over Europe, thanks to an erupting volcano in Iceland, air travel has been severely restricted, causing most",0
human,61,60,"As a singer of sinister songs and a director of horror films, Raw special guest host Rob Zombie has experience with the darker side of human",0
finn,61,60,"After two grueling Fatal 4-Way Matches set the stage for an intense Raw main event clash between Finn Bálor and Roman Reigns, it was the ath",0
college,61,61,"When Sheldon is no longer academically challenged at Medford High, he audits a college class taught by Dr. John Sturgis.",0
bheem,61,59,"All Bheem wants to do is chase a flower in the woods, but can he grab it before a hungry lion gets him?",0
think,60,60,"As alliances form among the players, no one is safe in the dorm after lights-out. The third game challenges Gi-hun's team to think strategic",0
halloween,60,56,"Gi-hun finally gets hold of an invitation, marked for Halloween day. In a tense moment facing Jun-ho, they reveal their truths to each other",0
helping,60,60,"A pumpkin lantern made of glass comes crashing down in a plaza in front of Sakuragicho Station, just as a social media post with the hashtag",0
music,60,56,"Sakuta has a dream that Mai reveals herself as the true identity of Touko Kirishima at a music festival held on April 1st. At the same time,",0
hat,60,54,"A tiny top hat delivery leads to a dazzling day for new magician Baby Box; meanwhile, her closest friends help her perform a boppin'-and-hop",0
art,60,51,"The Gabby Cats need to make a special art project for Baby Box's Meow-Seum Day. But with many different ways to make art, who knows what the",0
throw,60,60,"Peppa and George are helping Granny and Grandpa Pig tidy their attic, but they have trouble deciding what to throw out, because Granny and G",0
support,60,60,"A member of The Hart family joins The King's Court to show his support for Bob Backlund. Plus, Double J, Mabel, and more in action.",0
regarding,60,60,Lex Luger faces Yokozuna in a King of the Ring qualifying match. Jerry Lawler has a message for Bret Hart regarding their upcoming match.,0
celebration,60,59,"Mr. McMahon welcomes The Rock as the new WWE Champion. But before the celebration can get under way, ""Stone Cold"" Steve Austin reveals a cla",0
fernando,60,60,"Tonight's episode of Raw is being broadcast live from the Pepsi Center in Denver, CO. The scheduled matches for tonight’s card are:

Singles",0
