token,freq,df,sample,weight
match,3884,1380,"After his match with El Matador, Ric Flair issues a career changing challenge to Mr. Perfect for Raw next week. WWE Champion Bret Hitman Har",0
threatening,0,0,"",-2
escalate,0,0,"",-1
escalating,0,0,"",-1
conflict,0,0,"",-1
sacrifice,0,0,"",-1
incredible,0,0,"",1
stakes,0,0,"",-1
crazy,0,0,"",-1
bounty,0,0,"",-1
escalated,0,0,"",-1
escalates,0,0,"",-1
escalation,0,0,"",-1
sacrificed,0,0,"",-1
sacrifices,0,0,"",-1
sacrificing,0,0,"",-1
conflicts,0,0,"",-1
conflicting,0,0,"",-1
bounties,0,0,"",-1
incredibly,0,0,"",1
team,2565,2004,"As alliances form among the players, no one is safe in the dorm after lights-out. The third game challenges Gi-hun's team to think strategic",0
new,2144,1982,"A vengeful Gi-hun makes a U-turn at the airport. Later, in his hideout, he intensifies his search for the elusive recruiter who is seeking n",0
after,2035,1910,"As alliances form among the players, no one is safe in the dorm after lights-out. The third game challenges Gi-hun's team to think strategic",0
wwe,1817,1397,"After his match with El Matador, Ric Flair issues a career changing challenge to Mr. Perfect for Raw next week. WWE Champion Bret Hitman Har",0
him,1713,1431,"Sakuta had been unable to see Mai, who was not only busy with work but had an order from her agency forbidding her from going on dates. The ",0
meanwhile,1383,1378,"A few players enter the next round — which promises equal doses of sweet and deadly — with hidden advantages. Meanwhile, Jun-ho sneaks his w",0
about,1308,1184,"Even after leaving Fujisawa for Ogaki, not one person remembered anything about Mai Sakurajima. Sakuta and Mai return to school together, bu",0
tag,1285,930,"Mai responds to the media, asserting that she is not the real identity of Touko Kirishima on Coming of Age Day. Nevertheless, the impact of ",0
singles,1272,477,"Jerry ""The King"" Lawler squares off against Jim Powers. The Beverly Brothers battle The Steiner Brothers in tag team action. Virgil faces Ba",0
champion,1269,996,Daddy Pig loses his title as champion puddle jumper.,0
against,1165,1056,"After his match with El Matador, Ric Flair issues a career changing challenge to Mr. Perfect for Raw next week. WWE Champion Bret Hitman Har",0
big,1134,1005,"Get ready to race, jump and fly as Gabby, Pandy, Carlita and the DooDads compete for a big, beautiful Meow-Mazing Games trophy!",0
help,1040,1003,Jun-ho's team gets close to finding the island. Jang Geum-ja makes a desperate plea to Gi-hun to help Jun-hee. The VIPs discuss a cruel prop,1
title,1020,665,Daddy Pig loses his title as champion puddle jumper.,0
championship,1018,844,Money Inc. prepares for their Tag Team Championship Match at Wrestlemania. Andre The Giant is announced as the first Inductee to the WWE Hal,0
take,941,908,"Hoping to win easy money, a broke and desperate Gi-hun agrees to take part in an enigmatic game. Not long into the first round, unforeseen h",0
find,930,880,"Sakuta from the other possible realm sends a message through Ikumi that reads, “Find Touko Kirishima, Mai-san is in danger.” After seeing th",0
plus,912,911,"""Hacksaw"" Jim Duggan leads a tribute to the good old USA. Intercontinental Champion Marty Janetty defends the title against Bam Bam Bigelow.",0
get,904,859,It’s almost time to get groovy at the music store grand opening! Can Gabby and Pandy earn enough kitty coins to buy an instrument?,0
takes,902,871,"Puberty syndrome – Abnormal experiences rumored on the internet to be caused by sensitivity and instability during adolescence. This year, S",0
smackdown,850,750,"The Undertaker challenges ""Stone Cold"" Steve Austin for his WWE Championship. Billy Gunn's attempts to humiliate The Rock fall short after T",0
gets,824,798,"Gi-hun finally gets hold of an invitation, marked for Halloween day. In a tense moment facing Jun-ho, they reveal their truths to each other",0
john,814,720,"While preparing to go one-on-one with Edge, Batista's attention turns to SmackDown's WWE Champion John ""Bradshaw"" Layfield who's impending a",0
time,808,765,"The final round presents another cruel test — but this time, how it ends depends on just one player. The game's creator steps out of the sha",0
raw,802,645,The Premiere episode of Monday Night Raw. The Undertaker battles Damien Demento in Raw's first-ever main event. Shawn Michaels competes.,0
luffy,795,631,"A group of pirates lead by Alvida plunder a ship, only to find a barrel which contains a strange boy named Luffy. Luffy is on a mission to f",0
back,788,747,"With Nodoka's Puberty Syndrome resolved, Sakuta's expectations to spend sweeter times with Mai is growing. But then, a scandal is reported b",0
show,751,720,"The Masked Leader welcomes VIP guests to the facility for a front-row viewing of the show. In the fifth game, some players crack under press",0
man,746,654,"Even as Gi-hun supports Jun-hee amid rising tensions, she must make a pivotal decision. Before the final game, the Front Man gives Gi-hun an",0
day,722,685,"Gi-hun finally gets hold of an invitation, marked for Halloween day. In a tense moment facing Jun-ho, they reveal their truths to each other",0
tries,715,690,"No-eul tries to gain the upper hand in negotiations, but her plans backfire. Gi-hun faces a moral crossroads, testing his limits — how far w",0
family,715,686,"On a rainy day, Gabby and friends must take care of Kico — a baby KittyCorn who's part kitty, part unicorn — until it's time for her to meet",2
world,704,656,"Split on whether to continue or quit, the group holds a vote. But their realities in the outside world may prove to be just as unforgiving a",0
tonight's,695,426,"Tonight's episode of Raw is being broadcast live from the Baltimore Arena in Baltimore, MD. The scheduled matches for tonight’s card are:

S",0
make,689,666,"Even as Gi-hun supports Jun-hee amid rising tensions, she must make a pivotal decision. Before the final game, the Front Man gives Gi-hun an",0
battle,688,661,"After being out for months following a devastating boating accident, Brutus 'The Barber' Beefcake returns to face 'The Million Dollar Man' T",0
off,675,656,"Players pair off for the fourth game. Gi-hun grapples with a moral dilemma, Sang-woo chooses self-preservation and Sae-byeok shares her unto",0
goes,671,656,A Miniskirt Santa suddenly appears before Sakuta. She says her name is “Touko Kirishima” and claims to have been handing out Puberty Syndrom,0
before,664,637,"Even as Gi-hun supports Jun-hee amid rising tensions, she must make a pivotal decision. Before the final game, the Front Man gives Gi-hun an",0
makes,658,644,"Ahead of the last round, distrust and disgust run deep among the finalists. Jun-ho makes a getaway, determined to expose the game's dirty se",0
first,623,588,"Hoping to win easy money, a broke and desperate Gi-hun agrees to take part in an enigmatic game. Not long into the first round, unforeseen h",0
event,612,602,"Sakuta has a dream that Mai reveals herself as the true identity of Touko Kirishima at a music festival held on April 1st. At the same time,",0
life,599,580,"Tall tales come to life with a king, a mermaid and so much more as Gabby and the gang create and celebrate enchanting fairytales in a storyb",0
triple,582,560,"Jim ""The Anvil"" Neidhart takes on Triple H. While the New Age Outlaws begin their reign as Tag Team Champions, the Legion of Doom goes on a ",0
much,576,569,"A pumpkin lantern made of glass comes crashing down in a plaza in front of Sakuragicho Station, just as a social media post with the hashtag",0
episode,575,567,The Premiere episode of Monday Night Raw. The Undertaker battles Damien Demento in Raw's first-ever main event. Shawn Michaels competes.,0
where,565,532,"The players prepare for the next game: a six-legged pentathlon, where each team member must clear a mini-game to survive — or face collectiv",0
finds,565,553,"After agreeing to harbor an abandoned cat, Sakuta finds himself welcoming a look-alike to his old school crush into his home. This does not ",0
face,561,517,"The players prepare for the next game: a six-legged pentathlon, where each team member must clear a mini-game to survive — or face collectiv",0
also,552,528,"Puberty syndrome – Abnormal experiences rumored on the internet to be caused by sensitivity and instability during adolescence. This year, S",0
main,549,543,The Premiere episode of Monday Night Raw. The Undertaker battles Damien Demento in Raw's first-ever main event. Shawn Michaels competes.,0
between,546,530,"Upon searching the hashtag #DREAMING, numerous posts were found about attending a middle school reunion on November 27th. Ikumi also dreamt ",0
faces,545,532,"The games resume, and Gi-hun fixates on confronting Kang Dae-ho. Meanwhile, Kim Jun-hee faces a sudden crisis that pushes her willpower to i",0
matches,543,541,Money Inc. prepares for their Tag Team Championship Match at Wrestlemania. Andre The Giant is announced as the first Inductee to the WWE Hal,0
friends,533,517,"Mush, mash and mix in a dash! Gabby and her friends prepare for a spa day. Meanwhile, MerCat deals with a sparkle disaster. Can the gang fin",2
house,526,426,"Upon inducing a case of ""Puberty Syndrome"" where two copies of herself exists, Rio ends up staying at Sakuta's house for the time being. Mea",0
randy,520,510,"Mr. Perfect battles Ric Flair in a Loser Leaves WWE Match. """"Macho Man"""" Randy Savage seeks revenge when he battles The Repo Man. Kamala, wi",0
case,519,483,"Upon inducing a case of ""Puberty Syndrome"" where two copies of herself exists, Rio ends up staying at Sakuta's house for the time being. Mea",0
way,512,497,"A few players enter the next round — which promises equal doses of sweet and deadly — with hidden advantages. Meanwhile, Jun-ho sneaks his w",0
own,512,493,"Even after leaving Fujisawa for Ogaki, not one person remembered anything about Mai Sakurajima. Sakuta and Mai return to school together, bu",0
kane,497,479,WWE mourns the untimely passing of Flyin' Brian Pillman. The Hart Foundation come face-to-face with Shawn Michaels and his band of degenerat,0
orton,496,481,"After preventing Rob Van Dam from capturing the World Heavyweight Championship against Triple H at Unforgiven, Ric Flair's relationship with",0
cena,492,470,"Triple H plans a surprise for the next pick in the WWE Draft. In his first match on Raw, WWE Champion John Cena teams with Chris Jericho to ",0
mcmahon,476,419,"Love is in the air as two members of the WWE Universe get engaged. Lex Luger and Crush battle it out, but what happens when several Doink th",0
non,466,301,"Tonight's episode of Raw is being broadcast live from the Baltimore Arena in Baltimore, MD. The scheduled matches for tonight’s card are:

S",0
fight,463,439,"Peppa and George go for a ride in Grandpa Pig's boat, but Grandpa Pig and Grandpa Dog get into a fight.",-1
card,457,455,"Tonight's episode of Raw is being broadcast live from the Baltimore Arena in Baltimore, MD. The scheduled matches for tonight’s card are:

S",0
past,455,449,"Sakuta unveils to Mai and Nodoka the details of his family's past, and the trauma that Kaede underwent. Meanwhile, Kaede continues her re-in",0
only,453,432,"Sakuta had been unable to see Mai, who was not only busy with work but had an order from her agency forbidding her from going on dates. The ",0
night,450,426,Gi-hun and his team take turns keeping guard through the night. The masked men encounter trouble with their co-conspirators.,0
plan,447,433,The remaining players strategize on how to survive the night. Gi-hun proposes a risky plan — but he will need trustworthy allies to carry it,0
old,447,425,"After agreeing to harbor an abandoned cat, Sakuta finds himself welcoming a look-alike to his old school crush into his home. This does not ",0
himself,444,430,"After agreeing to harbor an abandoned cat, Sakuta finds himself welcoming a look-alike to his old school crush into his home. This does not ",0
scheduled,444,444,"Tonight's episode of Raw is being broadcast live from the Baltimore Arena in Baltimore, MD. The scheduled matches for tonight’s card are:

S",0
action,440,428,"Even after leaving Fujisawa for Ogaki, not one person remembered anything about Mai Sakurajima. Sakuta and Mai return to school together, bu",0
broadcast,440,439,"In one of the most exciting awards ceremonies on television, bar none, Raw celebrated another year of the Slammy Awards. With the opening of",0
other,438,420,"Gi-hun finally gets hold of an invitation, marked for Halloween day. In a tense moment facing Jun-ho, they reveal their truths to each other",0
comes,435,424,"Sakuta had been unable to see Mai, who was not only busy with work but had an order from her agency forbidding her from going on dates. The ",0
chris,435,426,Triple H's aspirations of becoming WWE Champion are put in jeopardy when Chyna makes an unexpected demand. Commissioner Shawn Michaels does,0
challenge,432,405,"A new student, Gerald giraffe, joins the playgroup. They try a challenge of hide and seek.",0
work,430,414,"After agreeing to harbor an abandoned cat, Sakuta finds himself welcoming a look-alike to his old school crush into his home. This does not ",0
friend,424,411,"Even after leaving Fujisawa for Ogaki, not one person remembered anything about Mai Sakurajima. Sakuta and Mai return to school together, bu",2
save,418,402,Super Gabby and Super Pandy shrink down to save the day from a mischievous CatRat. Can they solve his playful puzzles? Let the marvelous mis,2
during,406,395,"Puberty syndrome – Abnormal experiences rumored on the internet to be caused by sensitivity and instability during adolescence. This year, S",0
cold,406,402,"After Kitty Fairy catches a cold, Gabby and Pandy deliver dandelion soup and step in to save the day.",0
another,403,393,"The final round presents another cruel test — but this time, how it ends depends on just one player. The game's creator steps out of the sha",0
ziggler,401,383,"The December 1, 2008 Edition of RAW is a Professional wrestling television show of the WWE's RAW brand, which took place on December 1, 2008",0
reigns,401,367,"Alberto Del Rio vs Big E. Langston
WWE United States Championship
- Dean Ambrose vs Kofi Kingston
WWE Tag Team Championships
- Roman Reigns ",0
murder,400,390,One of history's most famous murder victims pays the house a visit. Constance discovers more of Tate's bad behavior.,-3
steve,397,391,"The First Round matches of the 1996 King of the Ring are underway featuring Stone Cold Steve Austin, Jake 'The Snake' Roberts, and more.",0
dolph,395,380,"The December 1, 2008 Edition of RAW is a Professional wrestling television show of the WWE's RAW brand, which took place on December 1, 2008",0
king,394,353,"Tall tales come to life with a king, a mermaid and so much more as Gabby and the gang create and celebrate enchanting fairytales in a storyb",0
undertaker,392,390,The Premiere episode of Monday Night Raw. The Undertaker battles Damien Demento in Raw's first-ever main event. Shawn Michaels competes.,0
party,382,357,"A tiny suitcase surprise leads to a fancy hotel stay for Gabby and Pandy, featuring ""cat-abulous"" spa treatments and a popping pool party.",0
roman,380,362,"Alberto Del Rio vs Big E. Langston
WWE United States Championship
- Dean Ambrose vs Kofi Kingston
WWE Tag Team Championships
- Roman Reigns ",0
group,375,357,"Split on whether to continue or quit, the group holds a vote. But their realities in the outside world may prove to be just as unforgiving a",0
rock,374,368,Peppa and George help out Grandpa Pig create a rock garden.,0
jack,374,349,"Boxing Legend Mike Tyson is announced as the guest enforcer for the ""Stone Cold"" Steve Austin vs. Shawn Michaels match at WrestleMania. Paul",0
uso,374,206,"Rey Mysterio, Sin Cara &amp; R-Truth vs Antonio Cesaro, Darren Young &amp; Titus O'Neil
Daniel Bryan vCody Rhodes
Kane vs Damien Sandow
Shea",0
stone,370,365,"The First Round matches of the 1996 King of the Ring are underway featuring Stone Cold Steve Austin, Jake 'The Snake' Roberts, and more.",0
austin,367,361,"The First Round matches of the 1996 King of the Ring are underway featuring Stone Cold Steve Austin, Jake 'The Snake' Roberts, and more.",0
come,363,356,"Tall tales come to life with a king, a mermaid and so much more as Gabby and the gang create and celebrate enchanting fairytales in a storyb",0
daniel,361,344,"WWE Champion The Miz goes one-on-one with United States Champion Daniel Bryan, his former NXT pupil.",0
jericho,360,352,Triple H's aspirations of becoming WWE Champion are put in jeopardy when Chyna makes an unexpected demand. Commissioner Shawn Michaels does,0
intercontinental,359,346,"Love is in the air as two members of the WWE Universe get engaged. Lex Luger and Crush battle it out, but what happens when several Doink th",0
heavyweight,358,342,"In retaliation for Stephanie McMahon making Brock Lesnar and his Undisputed Championship exclusive to the SmackDown brand, Raw General Manag",0
finally,355,346,"Gi-hun finally gets hold of an invitation, marked for Halloween day. In a tense moment facing Jun-ho, they reveal their truths to each other",1
special,355,347,Gabby and Pandy receive special sashes and start their journey as kitty rangers! Can they use their new skills to solve a missing mama myste,0
however,354,348,"With Sakuta's help, Kaede is able to go to school at night. She is now enthusiastic about heading to school during the day. However, on the ",0
michael,354,292,"The Rock hosts a funeral for the career of WWE Champion ""Stone Cold"" Steve Austin. With Stephanie by his side, Mr. McMahon sits down with Mi",0
mysterio,353,342,"In the wake of the sudden and tragic passing of Eddie Guerrero, Superstars from both Raw and SmackDown come together to mourn the loss of La",0
kofi,353,336,CM Punk uses his Money in the Bank Contract to challenge Edge for the World Heavyweight Championship. After capturing the Intercontinental C,0
kingston,351,334,CM Punk uses his Money in the Bank Contract to challenge Edge for the World Heavyweight Championship. After capturing the Intercontinental C,0
home,349,340,"After agreeing to harbor an abandoned cat, Sakuta finds himself welcoming a look-alike to his old school crush into his home. This does not ",0
battles,347,339,The Premiere episode of Monday Night Raw. The Undertaker battles Damien Demento in Raw's first-ever main event. Shawn Michaels competes.,0
george,346,311,"It's raining and Peppa is sad because she can't play outside. When the rain stops, Peppa and George get to play one of their favourite games",0
secret,340,335,"Mummy Pig gives Peppa a box, which has to be kept a secret.",0
seth,339,314,"Episode #845

""Raw"" guest host Seth Green teams up with John Cena & Triple H to take on Legacy.",0
sheldon,339,315,9-year-old Sheldon Cooper is a once-in-a-generation mind capable of advanced mathematics and science but learns that isn’t always helpful gr,0
it's,337,324,"It's time to light up the night with a glow-in-the-dark delivery; Gabby, Pandy and DJ Catnip get to work on a train-building project.",0
try,337,333,George enjoys seeing his reflection in the mirror so much that he and Peppa try to find other shiny things to see themselves in.,0
sheamus,337,330,Triple H goes one-on-one with Chris Jericho; Sheamus takes on Santino Marella.,0
girls,336,214,"Puberty syndrome – Abnormal experiences rumored on the internet to be caused by sensitivity and instability during adolescence. This year, S",0
relationship,336,325,"On this episode of Monday Night Raw, the fallout from WrestleMania XI! Shawn Michaels' relationship with Sid takes a turn.",0
rey,336,330,"In the wake of the sudden and tragic passing of Eddie Guerrero, Superstars from both Raw and SmackDown come together to mourn the loss of La",0
death,336,314,"While the WWE Universe buzzes over the investigation into Mr. McMahon's alleged death in a mysterious limo explosion, Stephanie McMahon vows",-3
miz,336,316,Raw General Manager and current King of the Ring William Regal orders Mr. Kennedy and WWE Champion Triple H to team up against the entire EC,0
rollins,336,308,"Big Show vs Seth Rollins
Daniel Bryan vs Dolph Ziggler
Mark Henry vs Kofi Kingston
Ryback vs Heath Slater
Alberto Del Rio vs Antonio Cesaro
",0
found,335,321,"Upon searching the hashtag #DREAMING, numerous posts were found about attending a middle school reunion on November 27th. Ikumi also dreamt ",0
jimmy,334,314,"As Monday Night RAW unveils a brand new look, Bret Hart battles Hakushi, Shawn Michaels takes on Jimmy Del Ray, and much more.",0
stop,332,324,"Next stop: Birthday Island! In honor of Pandy’s big day, Gabby prepares a heartfelt gift, and the dollhouse friends celebrate with a series ",0
red,332,298,"Peppa loses her shoes, but she gets new red ones, making her happy again.",0
leads,327,321,A sparkly Meow Meow Mailbox surprise leads to a mysterious dollhouse mix-up. Can Gabby and the kitties find a fix... and some bubbly fun?,0
rhodes,327,308,Several RAW Superstars compete in Beat the Clock Matches for an opportunity to challenge John Cena for the WWE Championship at The Great Ame,0
looks,326,316,"Peppa looks after Madame Gazelle's guinea pigs Ginger and Brian while she goes on holiday, but prove to be more trouble for Mummy and Daddy ",0
woman,326,295,"Another woman comes forward with allegations that further discredit WWE Champion Shawn Michaels. Plus, The Undertaker, Goldust, and more.",0
just,325,319,"Split on whether to continue or quit, the group holds a vote. But their realities in the outside world may prove to be just as unforgiving a",0
edge,325,310,"Following his loss to Stone Cold Steve Austin at Over The Edge, Dude Love looks to leave the WWE for the good of mankind. The Undertaker mak",0
game,324,308,"Hoping to win easy money, a broke and desperate Gi-hun agrees to take part in an enigmatic game. Not long into the first round, unforeseen h",0
young,321,307,"Baby Alexander is too young to talk, until Peppa teaches him his first word.",0
cody,320,313,Several RAW Superstars compete in Beat the Clock Matches for an opportunity to challenge John Cena for the WWE Championship at The Great Ame,0
island,318,287,"Jun-ho and his team prepare to infiltrate a suspicious island. As monetary stakes and tensions rise, players split into two opposing faction",0
wants,316,306,"When Gabby receives a fishbowl in her Meow Meow Mailbox, CatRat wants to use it as a home for his itty bitty kittyfish. But they keep hiding",0
together,315,304,"Puberty syndrome – Abnormal experiences rumored on the internet to be caused by sensitivity and instability during adolescence. This year, S",1
turns,313,310,Gi-hun and his team take turns keeping guard through the night. The masked men encounter trouble with their co-conspirators.,0
straw,313,280,"Enraged by the actions of Buggy's crew, the city's mayor rushes to fight Buggy himself, but the Straw Hat Pirates come to his rescue. Zoro f",0
continues,312,300,"Unable to deal with a commercial filming well as the actress Mai Sakurajima, Nodoka gradually starts to feel a strong sense of inferiority. ",0
returns,312,307,"With Sakuta's help, Kaede is able to go to school at night. She is now enthusiastic about heading to school during the day. However, on the ",0
lemmings,310,250,"Freed by the thawing ice, a mysterious giant egg slides up to the front door of the log cabin. The Lemmings watch the hatching of large baby",0
attack,307,294,"A poltergeist-like phenomenon attacks Ikumi. Sakuta is worried the attack was caused by Puberty Syndrome, but Ikumi claims that the only way",-1
grizzy,306,248,"Freed by the thawing ice, a mysterious giant egg slides up to the front door of the log cabin. The Lemmings watch the hatching of large baby",0
next,304,287,"A few players enter the next round — which promises equal doses of sweet and deadly — with hidden advantages. Meanwhile, Jun-ho sneaks his w",0
shawn,304,302,The Premiere episode of Monday Night Raw. The Undertaker battles Damien Demento in Raw's first-ever main event. Shawn Michaels competes.,0
ncis,303,287,"When Penny’s big acting break on NCIS is a bust, Leonard struggles to help her, which results in Penny asking Leonard a bold relationship qu",0
peppa,297,263,"It's raining and Peppa is sad because she can't play outside. When the rain stops, Peppa and George get to play one of their favourite games",0
angle,296,286,"Stephanie McMahon and Test plan to tie the knot and spend the rest of their lives in wedded bliss, but Triple H doesn't hold his peace. Kane",0
final,294,264,"The final round presents another cruel test — but this time, how it ends depends on just one player. The game's creator steps out of the sha",0
search,294,288,"A vengeful Gi-hun makes a U-turn at the airport. Later, in his hideout, he intensifies his search for the elusive recruiter who is seeking n",0
kurt,294,289,"Stephanie McMahon and Test plan to tie the knot and spend the rest of their lives in wedded bliss, but Triple H doesn't hold his peace. Kane",0
discovers,293,291,"Daddy Pig takes Peppa and George to school on their scooters. When he decides that it would be quicker to ride back, he discovers that ridin",-1
learns,291,283,"Puberty syndrome – Abnormal experiences rumored on the internet to be caused by sensitivity and instability during adolescence. This year, S",0
bryan,291,271,"WWE Champion The Miz goes one-on-one with United States Champion Daniel Bryan, his former NXT pupil.",0
begins,289,281,"Upon inducing a case of ""Puberty Syndrome"" where two copies of herself exists, Rio ends up staying at Sakuta's house for the time being. Mea",0
